{
  "case_id": "lateral_canthotomy",
  "category": "Trauma",
  "source_pdf": "pdf/Trauma/Lateral Canthotomy.pdf",
  "initial_state": {
    "vitals": {
      "HR": 102,
      "BP_sys": 134,
      "BP_dia": 96,
      "RR": 22,
      "O2Sat": 100,
      "T": 36.5
    },
    "interventions": {
      "airway": false,
      "O2_device": null,
      "PEEP": 0,
      "FiO2": 0.21,
      "vent_rate": null,
      "vent_TV_ml": null,
      "intubated": false,
      "CPR_active": false,
      "defib_last_J": null,
      "pacing_active": false,
      "pacing_rate": null,
      "fluids_rate_ml_hr": 0,
      "fluid_type": null,
      "warming_active": false,
      "cooling_active": false,
      "needle_decompression": false,
      "chest_tube": false,
      "pericardiocentesis": false
    },
    "mechanism": {
      "pathology": {
        "name": "orbital_compartment_syndrome",
        "severity": "moderate"
      }
    }
  },
  "pairs": []
}
