{
  "case_id": "nightmares_case_1_bradycardia",
  "category": "Cardiology",
  "source_pdf": "pdf/Cardiology/Nightmares Case 1 Bradycardia.pdf",
  "initial_state": {
    "vitals": {
      "HR": 28,
      "BP_sys": 80,
      "BP_dia": 50,
      "RR": 18,
      "O2Sat": 99,
      "T": 37.0
    },
    "interventions": {
      "airway": false,
      "O2_device": null,
      "PEEP": 0,
      "FiO2": 0.21,
      "vent_rate": null,
      "vent_TV_ml": null,
      "intubated": false,
      "CPR_active": false,
      "defib_last_J": null,
      "pacing_active": false,
      "pacing_rate": null,
      "fluids_rate_ml_hr": 0,
      "fluid_type": null,
      "warming_active": false,
      "cooling_active": false,
      "needle_decompression": false,
      "chest_tube": false,
      "pericardiocentesis": false
    },
    "mechanism": {
      "pathology": {
        "name": "bradycardia",
        "severity": "severe"
      }
    }
  },
  "pairs": [
    {
      "id": "p1",
      "comment": "State 1 trigger: 'ECG completed -> State 2 Worsening Hypotension'. No time specified; default 120s.",
      "before": {
        "vitals": {
          "HR": 28,
          "BP_sys": 80,
          "BP_dia": 50,
          "RR": 18,
          "O2Sat": 99,
          "T": 37.0
        },
        "interventions": {
          "airway": false,
          "O2_device": null,
          "PEEP": 0,
          "FiO2": 0.21,
          "vent_rate": null,
          "vent_TV_ml": null,
          "intubated": false,
          "CPR_active": false,
          "defib_last_J": null,
          "pacing_active": false,
          "pacing_rate": null,
          "fluids_rate_ml_hr": 0,
          "fluid_type": null,
          "warming_active": false,
          "cooling_active": false,
          "needle_decompression": false,
          "chest_tube": false,
          "pericardiocentesis": false
        },
        "mechanism": {
          "pathology": {
            "name": "bradycardia",
            "severity": "severe"
          },
          "rhythm": "bradycardia"
        }
      },
      "actions": [],
      "duration_s": 120,
      "after": {
        "vitals": {
          "HR": 25,
          "BP_sys": 75,
          "BP_dia": 45,
          "RR": 18,
          "O2Sat": 99,
          "T": 37.0
        },
        "interventions": {
          "airway": false,
          "O2_device": null,
          "PEEP": 0,
          "FiO2": 0.21,
          "vent_rate": null,
          "vent_TV_ml": null,
          "intubated": false,
          "CPR_active": false,
          "defib_last_J": null,
          "pacing_active": false,
          "pacing_rate": null,
          "fluids_rate_ml_hr": 0,
          "fluid_type": null,
          "warming_active": false,
          "cooling_active": false,
          "needle_decompression": false,
          "chest_tube": false,
          "pericardiocentesis": false
        },
        "mechanism": {
          "pathology": {
            "name": "bradycardia",
            "severity": "severe"
          },
          "rhythm": "bradycardia"
        }
      }
    },
    {
      "id": "p2",
      "comment": "State 2 modifier: 'Atropine -> no effect'. Default first dose 0.5 mg IV.",
      "before": {
        "vitals": {
          "HR": 25,
          "BP_sys": 75,
          "BP_dia": 45,
          "RR": 18,
          "O2Sat": 99,
          "T": 37.0
        },
        "interventions": {
          "airway": false,
          "O2_device": null,
          "PEEP": 0,
          "FiO2": 0.21,
          "vent_rate": null,
          "vent_TV_ml": null,
          "intubated": false,
          "CPR_active": false,
          "defib_last_J": null,
          "pacing_active": false,
          "pacing_rate": null,
          "fluids_rate_ml_hr": 0,
          "fluid_type": null,
          "warming_active": false,
          "cooling_active": false,
          "needle_decompression": false,
          "chest_tube": false,
          "pericardiocentesis": false
        },
        "mechanism": {
          "pathology": {
            "name": "bradycardia",
            "severity": "severe"
          },
          "rhythm": "bradycardia"
        }
      },
      "actions": [
        {
          "type": "drug",
          "name": "atropine",
          "dose": 0.5,
          "unit": "mg",
          "route": "IV"
        }
      ],
      "duration_s": 120,
      "after": {
        "vitals": {
          "HR": 25,
          "BP_sys": 75,
          "BP_dia": 45,
          "RR": 18,
          "O2Sat": 99,
          "T": 37.0
        },
        "interventions": {
          "airway": false,
          "O2_device": null,
          "PEEP": 0,
          "FiO2": 0.21,
          "vent_rate": null,
          "vent_TV_ml": null,
          "intubated": false,
          "CPR_active": false,
          "defib_last_J": null,
          "pacing_active": false,
          "pacing_rate": null,
          "fluids_rate_ml_hr": 0,
          "fluid_type": null,
          "warming_active": false,
          "cooling_active": false,
          "needle_decompression": false,
          "chest_tube": false,
          "pericardiocentesis": false
        },
        "mechanism": {
          "pathology": {
            "name": "bradycardia",
            "severity": "severe"
          },
          "rhythm": "bradycardia"
        }
      }
    }
  ]
}