{
  "case_id": "covid_19_ambulatory_care",
  "category": "Communication",
  "source_pdf": "pdf/Communication/COVID-19 Ambulatory Care.pdf",
  "initial_state": {
    "vitals": {
      "HR": 120,
      "BP_sys": 130,
      "BP_dia": 75,
      "RR": 25,
      "O2Sat": 89,
      "T": 39.1
    },
    "interventions": {
      "airway": false,
      "O2_device": null,
      "PEEP": 0,
      "FiO2": 0.21,
      "vent_rate": null,
      "vent_TV_ml": null,
      "intubated": false,
      "CPR_active": false,
      "defib_last_J": null,
      "pacing_active": false,
      "pacing_rate": null,
      "fluids_rate_ml_hr": 0,
      "fluid_type": null,
      "warming_active": false,
      "cooling_active": false,
      "needle_decompression": false,
      "chest_tube": false,
      "pericardiocentesis": false
    },
    "mechanism": {
      "pathology": {
        "name": "pneumonia",
        "severity": "moderate"
      }
    }
  },
  "pairs": [
    {
      "id": "p1",
      "comment": "State 2 Isolation Room modifier: 'O2 applied -> SpO2 to 95%'. Scenario says 'Apply O2' and Transport state lists 'NP' (nasal prongs).",
      "before": {
        "vitals": {
          "HR": 120,
          "BP_sys": 130,
          "BP_dia": 75,
          "RR": 25,
          "O2Sat": 89,
          "T": 39.1
        },
        "interventions": {
          "airway": false,
          "O2_device": null,
          "PEEP": 0,
          "FiO2": 0.21,
          "vent_rate": null,
          "vent_TV_ml": null,
          "intubated": false,
          "CPR_active": false,
          "defib_last_J": null,
          "pacing_active": false,
          "pacing_rate": null,
          "fluids_rate_ml_hr": 0,
          "fluid_type": null,
          "warming_active": false,
          "cooling_active": false,
          "needle_decompression": false,
          "chest_tube": false,
          "pericardiocentesis": false
        },
        "mechanism": {
          "pathology": {
            "name": "pneumonia",
            "severity": "moderate"
          },
          "rhythm": null
        }
      },
      "actions": [
        {
          "type": "intervention",
          "name": "apply_nasal"
        }
      ],
      "duration_s": 0,
      "after": {
        "vitals": {
          "HR": 120,
          "BP_sys": 130,
          "BP_dia": 75,
          "RR": 25,
          "O2Sat": 95,
          "T": 39.1
        },
        "interventions": {
          "airway": false,
          "O2_device": "nasal",
          "PEEP": 0,
          "FiO2": 0.3,
          "vent_rate": null,
          "vent_TV_ml": null,
          "intubated": false,
          "CPR_active": false,
          "defib_last_J": null,
          "pacing_active": false,
          "pacing_rate": null,
          "fluids_rate_ml_hr": 0,
          "fluid_type": null,
          "warming_active": false,
          "cooling_active": false,
          "needle_decompression": false,
          "chest_tube": false,
          "pericardiocentesis": false
        },
        "mechanism": {
          "pathology": {
            "name": "pneumonia",
            "severity": "moderate"
          },
          "rhythm": null
        }
      }
    },
    {
      "id": "p2",
      "comment": "State 3 MD Assessment modifier: 'IV Fluid bolus -> HR to 105'. Transport state confirms HR 105.",
      "before": {
        "vitals": {
          "HR": 120,
          "BP_sys": 130,
          "BP_dia": 75,
          "RR": 25,
          "O2Sat": 95,
          "T": 39.1
        },
        "interventions": {
          "airway": false,
          "O2_device": "nasal",
          "PEEP": 0,
          "FiO2": 0.3,
          "vent_rate": null,
          "vent_TV_ml": null,
          "intubated": false,
          "CPR_active": false,
          "defib_last_J": null,
          "pacing_active": false,
          "pacing_rate": null,
          "fluids_rate_ml_hr": 0,
          "fluid_type": null,
          "warming_active": false,
          "cooling_active": false,
          "needle_decompression": false,
          "chest_tube": false,
          "pericardiocentesis": false
        },
        "mechanism": {
          "pathology": {
            "name": "pneumonia",
            "severity": "moderate"
          },
          "rhythm": null
        }
      },
      "actions": [
        {
          "type": "intervention",
          "name": "give_fluids",
          "value": 1000
        }
      ],
      "duration_s": 0,
      "after": {
        "vitals": {
          "HR": 105,
          "BP_sys": 130,
          "BP_dia": 75,
          "RR": 25,
          "O2Sat": 95,
          "T": 39.1
        },
        "interventions": {
          "airway": false,
          "O2_device": "nasal",
          "PEEP": 0,
          "FiO2": 0.3,
          "vent_rate": null,
          "vent_TV_ml": null,
          "intubated": false,
          "CPR_active": false,
          "defib_last_J": null,
          "pacing_active": false,
          "pacing_rate": null,
          "fluids_rate_ml_hr": 1000,
          "fluid_type": "crystalloid",
          "warming_active": false,
          "cooling_active": false,
          "needle_decompression": false,
          "chest_tube": false,
          "pericardiocentesis": false
        },
        "mechanism": {
          "pathology": {
            "name": "pneumonia",
            "severity": "moderate"
          },
          "rhythm": null
        }
      }
    }
  ]
}
