{
  "case_id": "breech_delivery_nrp",
  "category": "OB-GYN",
  "source_pdf": "pdf/OB-GYN/Breech Delivery + NRP.pdf",
  "initial_state": {
    "vitals": {
      "HR": 120,
      "BP_sys": 125,
      "BP_dia": 80,
      "RR": 22,
      "O2Sat": 100,
      "T": 36.5
    },
    "interventions": {
      "airway": false,
      "O2_device": null,
      "PEEP": 0,
      "FiO2": 0.21,
      "vent_rate": null,
      "vent_TV_ml": null,
      "intubated": false,
      "CPR_active": false,
      "defib_last_J": null,
      "pacing_active": false,
      "pacing_rate": null,
      "fluids_rate_ml_hr": 0,
      "fluid_type": null,
      "warming_active": false,
      "cooling_active": false,
      "needle_decompression": false,
      "chest_tube": false,
      "pericardiocentesis": false
    },
    "mechanism": {
      "pathology": {
        "name": "breech_delivery",
        "severity": "moderate"
      }
    }
  },
  "pairs": [
    {
      "id": "p1",
      "comment": "Maternal vitals only (dual-patient case; neonatal NRP does not fit schema). Trigger: '2 minutes -> Patient Arrival'. State 2 vitals.",
      "before": {
        "vitals": {
          "HR": 120,
          "BP_sys": 125,
          "BP_dia": 80,
          "RR": 22,
          "O2Sat": 100,
          "T": 36.5
        },
        "interventions": {
          "airway": false,
          "O2_device": null,
          "PEEP": 0,
          "FiO2": 0.21,
          "vent_rate": null,
          "vent_TV_ml": null,
          "intubated": false,
          "CPR_active": false,
          "defib_last_J": null,
          "pacing_active": false,
          "pacing_rate": null,
          "fluids_rate_ml_hr": 0,
          "fluid_type": null,
          "warming_active": false,
          "cooling_active": false,
          "needle_decompression": false,
          "chest_tube": false,
          "pericardiocentesis": false
        },
        "mechanism": {
          "pathology": {
            "name": "breech_delivery",
            "severity": "moderate"
          },
          "rhythm": null
        }
      },
      "actions": [],
      "duration_s": 120,
      "after": {
        "vitals": {
          "HR": 122,
          "BP_sys": 138,
          "BP_dia": 80,
          "RR": 22,
          "O2Sat": 100,
          "T": 36.5
        },
        "interventions": {
          "airway": false,
          "O2_device": null,
          "PEEP": 0,
          "FiO2": 0.21,
          "vent_rate": null,
          "vent_TV_ml": null,
          "intubated": false,
          "CPR_active": false,
          "defib_last_J": null,
          "pacing_active": false,
          "pacing_rate": null,
          "fluids_rate_ml_hr": 0,
          "fluid_type": null,
          "warming_active": false,
          "cooling_active": false,
          "needle_decompression": false,
          "chest_tube": false,
          "pericardiocentesis": false
        },
        "mechanism": {
          "pathology": {
            "name": "breech_delivery",
            "severity": "moderate"
          },
          "rhythm": null
        }
      }
    },
    {
      "id": "p2",
      "comment": "Trigger: '3 mins or all learner actions complete -> Delivery'. State 3 vitals.",
      "before": {
        "vitals": {
          "HR": 122,
          "BP_sys": 138,
          "BP_dia": 80,
          "RR": 22,
          "O2Sat": 100,
          "T": 36.5
        },
        "interventions": {
          "airway": false,
          "O2_device": null,
          "PEEP": 0,
          "FiO2": 0.21,
          "vent_rate": null,
          "vent_TV_ml": null,
          "intubated": false,
          "CPR_active": false,
          "defib_last_J": null,
          "pacing_active": false,
          "pacing_rate": null,
          "fluids_rate_ml_hr": 0,
          "fluid_type": null,
          "warming_active": false,
          "cooling_active": false,
          "needle_decompression": false,
          "chest_tube": false,
          "pericardiocentesis": false
        },
        "mechanism": {
          "pathology": {
            "name": "breech_delivery",
            "severity": "moderate"
          },
          "rhythm": null
        }
      },
      "actions": [],
      "duration_s": 180,
      "after": {
        "vitals": {
          "HR": 130,
          "BP_sys": 140,
          "BP_dia": 90,
          "RR": 28,
          "O2Sat": 100,
          "T": 36.5
        },
        "interventions": {
          "airway": false,
          "O2_device": null,
          "PEEP": 0,
          "FiO2": 0.21,
          "vent_rate": null,
          "vent_TV_ml": null,
          "intubated": false,
          "CPR_active": false,
          "defib_last_J": null,
          "pacing_active": false,
          "pacing_rate": null,
          "fluids_rate_ml_hr": 0,
          "fluid_type": null,
          "warming_active": false,
          "cooling_active": false,
          "needle_decompression": false,
          "chest_tube": false,
          "pericardiocentesis": false
        },
        "mechanism": {
          "pathology": {
            "name": "breech_delivery",
            "severity": "severe"
          },
          "rhythm": null
        }
      }
    },
    {
      "id": "p3",
      "comment": "State 3 action: Oxytocin 10U IM (documented dose). Onset-to-peak IM ~5 min.",
      "before": {
        "vitals": {
          "HR": 130,
          "BP_sys": 140,
          "BP_dia": 90,
          "RR": 28,
          "O2Sat": 100,
          "T": 36.5
        },
        "interventions": {
          "airway": false,
          "O2_device": null,
          "PEEP": 0,
          "FiO2": 0.21,
          "vent_rate": null,
          "vent_TV_ml": null,
          "intubated": false,
          "CPR_active": false,
          "defib_last_J": null,
          "pacing_active": false,
          "pacing_rate": null,
          "fluids_rate_ml_hr": 0,
          "fluid_type": null,
          "warming_active": false,
          "cooling_active": false,
          "needle_decompression": false,
          "chest_tube": false,
          "pericardiocentesis": false
        },
        "mechanism": {
          "pathology": {
            "name": "breech_delivery",
            "severity": "severe"
          },
          "rhythm": null
        }
      },
      "actions": [
        {
          "type": "drug",
          "name": "oxytocin",
          "dose": 10,
          "unit": "U",
          "route": "IM"
        }
      ],
      "duration_s": 300,
      "after": {
        "vitals": {
          "HR": 130,
          "BP_sys": 140,
          "BP_dia": 90,
          "RR": 28,
          "O2Sat": 100,
          "T": 36.5
        },
        "interventions": {
          "airway": false,
          "O2_device": null,
          "PEEP": 0,
          "FiO2": 0.21,
          "vent_rate": null,
          "vent_TV_ml": null,
          "intubated": false,
          "CPR_active": false,
          "defib_last_J": null,
          "pacing_active": false,
          "pacing_rate": null,
          "fluids_rate_ml_hr": 0,
          "fluid_type": null,
          "warming_active": false,
          "cooling_active": false,
          "needle_decompression": false,
          "chest_tube": false,
          "pericardiocentesis": false
        },
        "mechanism": {
          "pathology": {
            "name": "breech_delivery",
            "severity": "severe"
          },
          "rhythm": null
        }
      }
    },
    {
      "id": "p4",
      "comment": "Trigger: 'Infant delivered -> 4. Post-delivery'. Default duration 120 s. State 4 maternal vitals.",
      "before": {
        "vitals": {
          "HR": 130,
          "BP_sys": 140,
          "BP_dia": 90,
          "RR": 28,
          "O2Sat": 100,
          "T": 36.5
        },
        "interventions": {
          "airway": false,
          "O2_device": null,
          "PEEP": 0,
          "FiO2": 0.21,
          "vent_rate": null,
          "vent_TV_ml": null,
          "intubated": false,
          "CPR_active": false,
          "defib_last_J": null,
          "pacing_active": false,
          "pacing_rate": null,
          "fluids_rate_ml_hr": 0,
          "fluid_type": null,
          "warming_active": false,
          "cooling_active": false,
          "needle_decompression": false,
          "chest_tube": false,
          "pericardiocentesis": false
        },
        "mechanism": {
          "pathology": {
            "name": "breech_delivery",
            "severity": "severe"
          },
          "rhythm": null
        }
      },
      "actions": [],
      "duration_s": 120,
      "after": {
        "vitals": {
          "HR": 105,
          "BP_sys": 120,
          "BP_dia": 80,
          "RR": 12,
          "O2Sat": 100,
          "T": 36.5
        },
        "interventions": {
          "airway": false,
          "O2_device": null,
          "PEEP": 0,
          "FiO2": 0.21,
          "vent_rate": null,
          "vent_TV_ml": null,
          "intubated": false,
          "CPR_active": false,
          "defib_last_J": null,
          "pacing_active": false,
          "pacing_rate": null,
          "fluids_rate_ml_hr": 0,
          "fluid_type": null,
          "warming_active": false,
          "cooling_active": false,
          "needle_decompression": false,
          "chest_tube": false,
          "pericardiocentesis": false
        },
        "mechanism": {
          "pathology": {
            "name": "breech_delivery",
            "severity": "mild"
          },
          "rhythm": null
        }
      }
    }
  ]
}
