{
  "case_id": "massive_pulmonary_embolism",
  "category": "Respiratory",
  "source_pdf": "pdf/Respiratory/Massive Pulmonary Embolism.pdf",
  "initial_state": {
    "vitals": {
      "HR": 115,
      "BP_sys": 95,
      "BP_dia": 60,
      "RR": 18,
      "O2Sat": 92,
      "T": 37.2
    },
    "interventions": {
      "airway": false,
      "O2_device": null,
      "PEEP": 0,
      "FiO2": 0.21,
      "vent_rate": null,
      "vent_TV_ml": null,
      "intubated": false,
      "CPR_active": false,
      "defib_last_J": null,
      "pacing_active": false,
      "pacing_rate": null,
      "fluids_rate_ml_hr": 0,
      "fluid_type": null,
      "warming_active": false,
      "cooling_active": false,
      "needle_decompression": false,
      "chest_tube": false,
      "pericardiocentesis": false
    },
    "mechanism": {
      "pathology": {
        "name": "pulmonary_embolism",
        "severity": "moderate"
      }
    }
  },
  "pairs": [
    {
      "id": "p1",
      "comment": "Trigger: '2 min -> 2. PEA Arrest'. Patient becomes unconscious/pulseless.",
      "before": {
        "vitals": {
          "HR": 115,
          "BP_sys": 95,
          "BP_dia": 60,
          "RR": 18,
          "O2Sat": 92,
          "T": 37.2
        },
        "interventions": {
          "airway": false,
          "O2_device": null,
          "PEEP": 0,
          "FiO2": 0.21,
          "vent_rate": null,
          "vent_TV_ml": null,
          "intubated": false,
          "CPR_active": false,
          "defib_last_J": null,
          "pacing_active": false,
          "pacing_rate": null,
          "fluids_rate_ml_hr": 0,
          "fluid_type": null,
          "warming_active": false,
          "cooling_active": false,
          "needle_decompression": false,
          "chest_tube": false,
          "pericardiocentesis": false
        },
        "mechanism": {
          "pathology": {
            "name": "pulmonary_embolism",
            "severity": "moderate"
          },
          "rhythm": null
        }
      },
      "actions": [],
      "duration_s": 120,
      "after": {
        "vitals": {
          "HR": 20,
          "BP_sys": 0,
          "BP_dia": 0,
          "RR": 0,
          "O2Sat": 68,
          "T": 37.2
        },
        "interventions": {
          "airway": false,
          "O2_device": null,
          "PEEP": 0,
          "FiO2": 0.21,
          "vent_rate": null,
          "vent_TV_ml": null,
          "intubated": false,
          "CPR_active": false,
          "defib_last_J": null,
          "pacing_active": false,
          "pacing_rate": null,
          "fluids_rate_ml_hr": 0,
          "fluid_type": null,
          "warming_active": false,
          "cooling_active": false,
          "needle_decompression": false,
          "chest_tube": false,
          "pericardiocentesis": false
        },
        "mechanism": {
          "pathology": {
            "name": "pulmonary_embolism",
            "severity": "severe"
          },
          "rhythm": null
        }
      }
    },
    {
      "id": "p2",
      "comment": "State 2 action: start CPR (30:2 until intubation).",
      "before": {
        "vitals": {
          "HR": 20,
          "BP_sys": 0,
          "BP_dia": 0,
          "RR": 0,
          "O2Sat": 68,
          "T": 37.2
        },
        "interventions": {
          "airway": false,
          "O2_device": null,
          "PEEP": 0,
          "FiO2": 0.21,
          "vent_rate": null,
          "vent_TV_ml": null,
          "intubated": false,
          "CPR_active": false,
          "defib_last_J": null,
          "pacing_active": false,
          "pacing_rate": null,
          "fluids_rate_ml_hr": 0,
          "fluid_type": null,
          "warming_active": false,
          "cooling_active": false,
          "needle_decompression": false,
          "chest_tube": false,
          "pericardiocentesis": false
        },
        "mechanism": {
          "pathology": {
            "name": "pulmonary_embolism",
            "severity": "severe"
          },
          "rhythm": null
        }
      },
      "actions": [
        {
          "type": "intervention",
          "name": "start_CPR"
        }
      ],
      "duration_s": 0,
      "after": {
        "vitals": {
          "HR": 20,
          "BP_sys": 0,
          "BP_dia": 0,
          "RR": 10,
          "O2Sat": 68,
          "T": 37.2
        },
        "interventions": {
          "airway": false,
          "O2_device": null,
          "PEEP": 0,
          "FiO2": 0.21,
          "vent_rate": null,
          "vent_TV_ml": null,
          "intubated": false,
          "CPR_active": true,
          "defib_last_J": null,
          "pacing_active": false,
          "pacing_rate": null,
          "fluids_rate_ml_hr": 0,
          "fluid_type": null,
          "warming_active": false,
          "cooling_active": false,
          "needle_decompression": false,
          "chest_tube": false,
          "pericardiocentesis": false
        },
        "mechanism": {
          "pathology": {
            "name": "pulmonary_embolism",
            "severity": "severe"
          },
          "rhythm": null
        }
      }
    },
    {
      "id": "p3",
      "comment": "State 2 action: intubate during arrest.",
      "before": {
        "vitals": {
          "HR": 20,
          "BP_sys": 0,
          "BP_dia": 0,
          "RR": 10,
          "O2Sat": 68,
          "T": 37.2
        },
        "interventions": {
          "airway": false,
          "O2_device": null,
          "PEEP": 0,
          "FiO2": 0.21,
          "vent_rate": null,
          "vent_TV_ml": null,
          "intubated": false,
          "CPR_active": true,
          "defib_last_J": null,
          "pacing_active": false,
          "pacing_rate": null,
          "fluids_rate_ml_hr": 0,
          "fluid_type": null,
          "warming_active": false,
          "cooling_active": false,
          "needle_decompression": false,
          "chest_tube": false,
          "pericardiocentesis": false
        },
        "mechanism": {
          "pathology": {
            "name": "pulmonary_embolism",
            "severity": "severe"
          },
          "rhythm": null
        }
      },
      "actions": [
        {
          "type": "intervention",
          "name": "intubate"
        }
      ],
      "duration_s": 0,
      "after": {
        "vitals": {
          "HR": 20,
          "BP_sys": 0,
          "BP_dia": 0,
          "RR": 12,
          "O2Sat": 68,
          "T": 37.2
        },
        "interventions": {
          "airway": false,
          "O2_device": "vent",
          "PEEP": 0,
          "FiO2": 1.0,
          "vent_rate": 12,
          "vent_TV_ml": 500,
          "intubated": true,
          "CPR_active": true,
          "defib_last_J": null,
          "pacing_active": false,
          "pacing_rate": null,
          "fluids_rate_ml_hr": 0,
          "fluid_type": null,
          "warming_active": false,
          "cooling_active": false,
          "needle_decompression": false,
          "chest_tube": false,
          "pericardiocentesis": false
        },
        "mechanism": {
          "pathology": {
            "name": "pulmonary_embolism",
            "severity": "severe"
          },
          "rhythm": null
        }
      }
    },
    {
      "id": "p4",
      "comment": "State 2 trigger: 'Consider thrombolytics (TNK 50 mg IV bolus). 3 min after thrombolytics given -> 3. ROSC'.",
      "before": {
        "vitals": {
          "HR": 20,
          "BP_sys": 0,
          "BP_dia": 0,
          "RR": 12,
          "O2Sat": 68,
          "T": 37.2
        },
        "interventions": {
          "airway": false,
          "O2_device": "vent",
          "PEEP": 0,
          "FiO2": 1.0,
          "vent_rate": 12,
          "vent_TV_ml": 500,
          "intubated": true,
          "CPR_active": true,
          "defib_last_J": null,
          "pacing_active": false,
          "pacing_rate": null,
          "fluids_rate_ml_hr": 0,
          "fluid_type": null,
          "warming_active": false,
          "cooling_active": false,
          "needle_decompression": false,
          "chest_tube": false,
          "pericardiocentesis": false
        },
        "mechanism": {
          "pathology": {
            "name": "pulmonary_embolism",
            "severity": "severe"
          },
          "rhythm": null
        }
      },
      "actions": [
        {
          "type": "drug",
          "name": "tenecteplase",
          "dose": 50,
          "unit": "mg",
          "route": "IV"
        }
      ],
      "duration_s": 180,
      "after": {
        "vitals": {
          "HR": 85,
          "BP_sys": 85,
          "BP_dia": 45,
          "RR": 12,
          "O2Sat": 96,
          "T": 37.2
        },
        "interventions": {
          "airway": false,
          "O2_device": "vent",
          "PEEP": 0,
          "FiO2": 1.0,
          "vent_rate": 12,
          "vent_TV_ml": 500,
          "intubated": true,
          "CPR_active": false,
          "defib_last_J": null,
          "pacing_active": false,
          "pacing_rate": null,
          "fluids_rate_ml_hr": 0,
          "fluid_type": null,
          "warming_active": false,
          "cooling_active": false,
          "needle_decompression": false,
          "chest_tube": false,
          "pericardiocentesis": false
        },
        "mechanism": {
          "pathology": {
            "name": "pulmonary_embolism",
            "severity": "severe"
          },
          "rhythm": null
        }
      }
    }
  ]
}
